{
  "channel": "beta",
  "from_publication_run": "35586124137",
  "from_publication_sha256": "3e83a30341c7c73b4d51b41afdaf30def5b0601e1772c7e2d9bf00ac189a1de0",
  "from_snapshot_id": "repo-f44-20260920-001",
  "reason": "Step 7 rollback canary to first successful beta publication",
  "rollback_run": "35586605715",
  "rolled_back_at": "2026-09-21T10:03:59Z",
  "schema_version": 1,
  "to_publication_run": "35530066972",
  "to_publication_sha256": "3e83a30341c7c73b4d51b41afdaf30def5b0601e1772c7e2d9bf00ac189a1de0",
  "to_snapshot_id": "repo-f44-20260920-001"
}
